{
  "brand_id": "calapres",
  "link_id": "idl_synthetic0002",
  "channel": "instagram",
  "inbox_id": "128031",
  "channel_identity_fingerprint": "aaaaaaaaaaaaaaaaaaaaaaaaaaaaaaaaaaaaaaaaaaaaaaaaaaaaaaaaaaaaaaaa",
  "fingerprint_key_version": "hmac-sha256-v2",
  "chatwoot_contact_id": "700002",
  "shopify_customer_gid": "gid://shopify/Customer/900002",
  "order_gid_scope": null,
  "verification_method": "owner_confirmed",
  "assurance_level": "verified",
  "verified_at": "2026-08-11T15:00:00Z",
  "expires_at": "2026-11-09T15:00:00Z",
  "revoked_at": null
}
